{
  "schema_version": 1,
  "kind": "ortak_kopru_yol",
  "hazirlayan": "Claude Code Bulut (Hacker odağı)",
  "hazirlandi": "2026-10-28T15:15:00Z",
  "amac": "Açılıştaki niyeti ve altı ilkeyi, her adımı ölçülebilir bir yolla gerçeğe dönüştürmek.",
  "giris": [
    "Açılış, Ortak Köprü'nün ne olmak istediğini söylüyor. Bu sayfa, oraya nasıl varılacağını adım adım gösteriyor. Her adım için neyin değişeceği, neden gerektiği, ne zaman atılabileceği ve bitince sizin için neyin değişeceği yazılı.",
    "Bu yol kendini denetler. Her adımın ölçütü var ve ölçütler her değişiklikte yeniden sınanıyor. Bir adım bitince bu sayfa da, açılıştaki durum yazısı da değişmek zorunda. Ölçütler ve dosyalar [yolun teknik ekinde](teknik/yol-teknik.md), bu yolun nasıl ortaya çıktığı [geçmiş işler](gecmis/README.md) bölümünde duruyor."
  ],
  "varilacak_yer": [
    "Yolun sonunda Ortak Köprü, açılışta söylediği şey olur. Yerel kullanıcı neyi paylaşacağını seçer ve seçtiği şey kaynağıyla dışarı çıkar. Dışarıdaki biri bir paragrafı okur, aklına takılanı o paragrafın yanına yazar. Yazdığı şey yerel kullanıcının önüne düşer, karşılığı aynı yoldan geri döner. Her adım kayda geçer ve hiçbir şey olduğundan fazla gösterilmez.",
    "Aşağıdaki resim bunu bir manzara gibi gösteriyor. Solda yerel kullanıcının çalışma yeri ve kapısı var. Ortada iki yöne taşıyan köprü, sağda dışarıdaki insanlar duruyor. Aşağıdan kapıya uzanan kesik çizgi, bugünden oraya giden yol."
  ],
  "plan": [
    "Aşağıdaki plan, Ortak Köprü'yü üstten görülen bir yapı gibi gösterir. Solda yerel kullanıcının odası, sağda dış avlu var. Aradaki duvarda tek bir kapı bulunuyor. Oklar neyin hangi yönde geçtiğini, parantez içindeki sayılar o geçişi koruyan ilkeyi gösteriyor.",
    "Planın okları bugün büyük ölçüde gerçek. Seçilen dosyaların dışarı çıkışı, kaynakların sürümüyle içeri girişi ve soruların gelen kutusuna inmesi kapının aracında hazır; aracı deponun herhangi bir kopyasında çalıştırmak yeter. Eksik tek ok, yanıtın aynı yoldan geri dönmesi. O adım Haluk'un kararını bekliyor."
  ],
  "izleme": [
    "Her adımın yanında bir durum yazar: tamam, atılabilir, karar bekliyor, ön koşul bekliyor, dışarıdan bekleniyor ya da ufukta. Bu durumlar elle yazılmaz; ölçütlerden hesaplanır. Bir adımın bütün ölçütleri karşılandığında adım tamam olur.",
    "Bir ilkeye bağlı bütün zorunlu adımlar bitince, açılışta o ilkenin durumu güncellenmek zorundadır. Güncellenmezse denetim kırılır. Tersine, bir ilke tam işliyor diye yazılmışsa ona bağlı açık bir adım kalamaz."
  ],
  "okur": [
    "Bu yolun en kısa adımı sizin elinizde. Açılışı ya da bu sayfayı okuyup bir soru sorar, bir kaynak ya da düzeltme getirirseniz dışarıdan gelen ilk katkı gerçekleşmiş olur. Web'de her bölümün sonunda bir karşılık bağlantısı var; hangi bölüme yazdığınızı forma kendisi yazar. İsterseniz [karşılık formunu doğrudan açın](https://github.com/HalukAINRS/ortak-kopru/issues/new?template=karsilik.yml); GitHub buna Issue der.",
    "Bir adımın nasıl atılacağına dair öneriniz varsa onu da yazabilirsiniz. Öneriler yerel kullanıcının kararına sunulur, kendiliğinden uygulanmaz."
  ],
  "teknik_giris": [
    "Bu ek, açılıştan gerçeğe giden yolun teknik karşılığıdır. Her adımın bağlantıları, ölçütleri, ölçütlerin bugünkü değerleri, dokunacağı yerler ve geri alma yolu burada durur. Sade anlatım yol sayfasındadır.",
    "Kayıt `docs/yol.json`, sözleşmesi `schemas/yol.schema.json`, aracı `tools/yol.py`. `python tools/yol.py --check` ölçütleri depoya karşı hesaplar, adımların ön koşul sırasını ve ilkelerle açılış arasındaki tutarlılığı denetler, iki belgenin kayıtla eşliğini sınar. `python tools/yol.py --durum` her adımın hesaplanan durumunu JSON olarak verir."
  ],
  "cizimler": [
    {
      "kimlik": "varilacak-yer",
      "tur": "ressam",
      "yer": "belge",
      "bolum": "varilacak_yer",
      "baslik": "Varılacak yer",
      "metin": "                \\   |   /\n              ─   .───.   ─        varılacak yer\n   ____________  (     )  ______________________________\n               \\__`───'__/\n  ┌─────────┐                                o    o\n  │ yerel   │    ╔═════════════════════╗    /|\\  /|\\\n  │ çalışma ├════╣ ← soru, katkı       ╠════ / \\  / \\\n  │  ┌──┐   │    ║        yanıt, kayıt →║   dışarıdaki\n  └──┤░░├───┘    ╚═════════════════════╝   insanlar\n     └┬─┘ kapı ~~~~~~~~~~~~~~~~~~~~~~~~~~~~~~~~~~~~~~~~\n      :\n      :  yol: yedi adım\n      :\n      x  bugün buradayız"
    },
    {
      "kimlik": "yapinin-plani",
      "tur": "mimar",
      "yer": "belge",
      "bolum": "plan",
      "baslik": "Yapının planı",
      "metin": "  PLAN · üstten görünüş                     ölçek: yok\n  ┌────────────────────────────┬──────┬──────────────────────┐\n  │ YEREL ODA                  │      │ DIŞ AVLU · Web       │\n  │                            │      │                      │\n  │ [çalışma]─▶[seçilen]────────────────▶[yayın]        (3)  │\n  │              (2)           │  K   │                      │\n  │ [inceleme]◀──────────────────────────[kaynak]       (3)  │\n  │                            │  A   │                      │\n  │ [gelen kutusu]◀──────────────────────[soru, katkı]  (5)  │\n  │      │ (2)                 │  P   │                      │\n  │      ▼                     │  I   │                      │\n  │ [yerel kullanıcı]───────────────────▶[yanıt]        (1)  │\n  │ duvar (4): gizli olan      │      │        [okur]        │\n  │ bu odadan çıkmaz           │      │                      │\n  └────────────────────────────┴──────┴──────────────────────┘\n   (6) her ok bir kayıt bırakır; hiçbir ok iz silmez"
    },
    {
      "kimlik": "katkinin-yasami",
      "tur": "muhendis",
      "yer": "teknik",
      "bolum": "akis",
      "baslik": "Gelen bir katkının yaşamı",
      "metin": "  GELEN BİR KATKININ YAŞAMI · durum makinesi\n\n  ┌───────────┐ konu     ┌───────────┐ kapı     ┌───────────┐\n  │ dışarıda  ├─────────▶│ Web'de    ├─────────▶│ gelen     │\n  │ bir fikir │ açılır   │ yayımda   │ çeker    │ kutusunda │\n  └───────────┘          └───────────┘          └──┬────────┘\n                                                   │ yerel\n                                                   │ kullanıcı\n                                                   ▼ okur\n  ┌───────────┐ yanıt    ┌───────────┐ karar    ┌───────────┐\n  │ bağlandı  │◀─────────┤ yanıtlandı│◀─────────┤ okundu    │\n  │ (5)       │ döner    │ (1)       │ verilir  │ (2)       │\n  └───────────┘          └───────────┘          └───────────┘\n  (6) her geçiş ayrı bir olaydır ve kayda geçer. Hiçbir\n  durum atlanmaz; yanıt gelmemesi kabul sayılmaz, katkı\n  'bekliyor' olarak görünür kalır."
    },
    {
      "kimlik": "gelen-kutusu-sirasi",
      "tur": "muhendis",
      "yer": "teknik",
      "bolum": "akis",
      "baslik": "Gelen kutusu ve yanıt",
      "metin": "  GELEN KUTUSU VE YANIT · sıra çizimi\n\n okur            Web           kapı      yerel kullanıcı\n   │              │              │              │\n   │ konu açar    │              │              │\n   ├─────────────▶│              │              │\n   │              │ kapı okur    │              │\n   │              │◀─────────────┤              │\n   │              ├─────────────▶│              │\n   │              │              │ kutuya koyar │\n   │              │              │ yazar, zaman │\n   │              │              │ ve yer ile   │\n   │              │              ├─────────────▶│\n   │              │              │              │ okur, karar\n   │              │              │              │ verir\n   │              │              │◀─────────────┤\n   │              │              │ yanıtı yazar │\n   │              │◀─────────────┤              │\n   │◀─────────────┤              │              │\n   │ yanıtı görür │              │              │\n   │              │              │              │\n  Her ok ayrı bir olaydır. Belirsiz kalan bir yazma,\n  gönderimde olduğu gibi uzlaştırılmadan yapıldı sayılmaz."
    }
  ],
  "adimlar": [
    {
      "no": 0,
      "kimlik": "zemin",
      "ad": "Zemin",
      "ilkeler": [
        3,
        6
      ],
      "zorunlu": true,
      "onkosul": [],
      "karar": null,
      "buyukluk": "orta",
      "sade": {
        "ne": "Açılış yazıldı, depo alanlarına ayrıldı ve kendini denetleyen bir harita kuruldu.",
        "neden": "Bir yerin gerçeğe dönüştüğünü görebilmek için önce neyin söz verildiğini ve neyin bugün işlediğini ayırmak gerekir.",
        "nerede": "Deponun kendisinde: açılışta, haritada ve denetimlerde. Bu zemin 28 Ekim'den beri GitHub'daki ana depoda; oraya hangi aşamalarla geçildiği [dönüşüm sayfasında](gecmis/donusum.md) anlatılıyor.",
        "yon": "İçeride kalır; dışarıya bir şey taşımaz.",
        "nasil": "Niyet, altı ilke ve her ilkenin bugünkü durumu bir kayda yazıldı. Sayfalar o kayıttan üretiliyor ve her değişiklikte yeniden sınanıyor.",
        "sonra": "Okuduğunuz her durum yazısı bir denetime dayanıyor. Bir şey değişirse yazı da değişmek zorunda."
      },
      "teknik": {
        "nerede": [
          "docs/acilis.json",
          "docs/harita.json",
          "tools/dogrula.py"
        ],
        "yon": "depo içi",
        "nasil": "Açılış, harita ve tanım kayıtları; `tools/acilis.py`, `tools/harita.py` ve `tools/dogrula.py` ile üretim ve denetim. Ana dala geçişin aşamaları, provası ve ölçümü: `docs/gecmis/donusum.json`, `tools/donusum.py`.",
        "geri_alma": "İlgili commit'ler geri alınır; kayıtlar ve belgeler önceki hâline döner."
      },
      "olcutler": [
        {
          "tur": "dosya_var",
          "yol": "docs/acilis.json"
        },
        {
          "tur": "dosya_var",
          "yol": "docs/harita.json"
        },
        {
          "tur": "dosya_icerir",
          "yol": "tools/dogrula.py",
          "desen": "tools/harita.py"
        }
      ]
    },
    {
      "no": 1,
      "kimlik": "sinir",
      "ad": "Gönderici yalnız seçileni gönderir",